Date,Text,Retweets,Likes
2014-05-29 12:40,Don't miss your chance: http://ofa.bo/gjg pic.twitter.com/96gtoUvHSG,255,591
2014-05-29 14:22,Good news: Health care costs are growing at the slowest rate in 50 years. More from @voxdotcom:http://ofa.bo/eig ,579,879
2014-05-29 15:42,You could meet James Taylor. Enter today: http://ofa.bo/hiw pic.twitter.com/HGKEyuvxL4,419,903
2014-05-30 12:27,Sign this petition if you believe it's time for a higher minimum wage: http://ofa.bo/ajm  #RaiseTheWage,753,1007
2014-05-31 10:00,In his weekly address President Obama discusses new proposals to curb carbon pollution from existing power plants. http://ofa.bo/hjP ,383,650
2014-05-31 11:08,For the sake of our children we have to do more. —President Obama http://ofa.bo/ble  #ActOnClimate,1053,1375
2014-05-31 12:15,A win for public health: The first-ever national limits on carbon pollution from existing power plants.pic.twitter.com/oHUP8QwII9,2513,2879
2014-06-01 07:16,Ashly was a fellow at @OFA this year. Read her story: http://ofa.bo/hjc ,229,509
2014-06-01 09:59,President Obama is acting on public health—with the first-ever national limits on carbon pollution from existing power plants. #ActOnClimate,889,1256
2014-06-01 13:02,ICYMI: @OFA volunteers rallied to gather signatures for a minimum wage petition. http://ofa.bo/flH  #RaiseTheWage,331,580
2014-06-02 07:30,WATCH: @GinaEPA is making a big announcement on fighting climate change and keeping the air clean for our families.http://ofa.bo/rkv ,282,558
2014-06-02 08:58,Add your name if you stand with President Obama and aggressive action on climate change. http://ofa.bo/ikr pic.twitter.com/z1k4Q4JWLE,3504,3187
2014-06-02 10:31,DYK: New emission standards will shrink electric bills by about 8% by increasing energy efficiency and reducing demand.,449,721
2014-06-02 12:04,Power plants are responsible for about 40% of America's carbon pollution. —President Obama #ActOnClimate,713,891
2014-06-02 12:19,In America we do not have to choose between the health of our economy and the health of our kids. —President Obama #ActOnClimate,1295,1747
2014-06-03 08:10,Watch: Climate change is real and it's happening now. See how President Obama is taking action. http://ofa.bo/ql7  #ActOnClimate,524,738
2014-06-03 09:23,Climate change activists scored a massive victory yesterday: http://ofa.bo/jk7  #ActOnClimate,585,804
2014-06-03 11:57,This coalition of 176 companies supports the President's action on climate change: http://ofa.bo/hk1  #ActOnClimate,474,673
2014-06-03 13:18,This is huge: President Obama proposed the first-ever national limits on carbon pollution from existing power plants.pic.twitter.com/vea1QRmAkC,2467,2999
2014-06-03 14:25,Retweet if you support the President’s strong action against carbon pollution. #ActOnClimate,5403,2324
2014-06-04 07:33,Carbon pollution is a real public health threat: Add your name to support cleaner air. http://ofa.bo/rlU  #ActOnClimate,672,862
2014-06-04 09:12,Read the President's message to @OFA supporters asking people to raise their voices on climate change: http://ofa.bo/qlP  #ActOnClimate,378,523
2014-06-04 11:25,Here's one important way to get involved with @OFA: http://ofa.bo/rlW ,322,506
2014-06-04 12:25,Take action this summer with @OFA's Organizing Fellowship:http://ofa.bo/pnl ,234,504
2014-06-05 07:53,Sign this petition: Stand for a higher minimum wage. http://ofa.bo/ill  #RaiseTheWage,641,822
2014-06-05 09:35,Watch: The band @OKGo announces the first-ever White House Maker Faire. http://ofa.bo/po1  #NationOfMakers,418,627
2014-06-05 11:10,Don't wait another moment to add your name: http://ofa.bo/tlW  #RaiseTheWage,443,683
2014-06-05 15:34,Retweet if you agree that working full-time for only $14500 a year isn't enough.pic.twitter.com/FceoNNpLvs,12561,6273
2014-06-06 07:27,This could be you this summer:http://ofa.bo/rm5 ,277,589
2014-06-06 11:41,We come to remember why America and our allies gave so much for the survival of liberty. —President Obama on the 70th anniversary of D-Day,1380,1549
2014-06-06 13:39,Good news: The economy added 216000 private sector jobs in May. #ActOnJobspic.twitter.com/8Oph1wxV78,1390,1818
2014-06-07 09:06,President Obama discusses the importance of helping lift the burden of student loan debt. http://ofa.bo/rmL  #ItsOurInterest,839,1174
2014-06-07 10:28,I will keep doing whatever I can without Congress to help responsible young people pay off their loans. —President Obama #ItsOurInterest,1638,2408
2014-06-07 13:39,Do your part: Stand with the President and #ActOnClimate. http://ofa.bo/alk ,583,992
2014-06-08 07:47,You can fight back against the polluters and special interest groups. Here's how: http://ofa.bo/jl9  #ActOnClimate,524,821
2014-06-08 10:33,Watch: Climate change is happening now and President Obama is taking action. http://ofa.bo/imN  #ActOnClimate,688,880
2014-06-08 13:17,All smiles.pic.twitter.com/u7FqkuOqjT,6421,15073
2014-06-09 06:19,Happening now: Watch the @WhiteHouse #WorkingFamilies Summit on Fatherhood with @Mets second baseman Daniel Murphy: http://ofa.bo/imU ,301,545
2014-06-09 10:35,The President will talk about reducing the burden of student loan debt at 1:45 p.m. ET. Tune in: http://ofa.bo/fmp  #CollegeOpportunity,597,652
2014-06-09 10:50,LIVE: President Obama is taking action to reduce the burden of student loan debt. http://ofa.bo/imX  #CollegeOpportunity,523,701
2014-06-09 10:55,We know—all of you know—that in a 21st century economy higher education is the single best investment in your future. —President Obama,876,938
2014-06-09 10:57,This is a country where opportunity should be available to anybody. —President Obama #CollegeOpportunity,827,1113
2014-06-09 11:00,In America higher education opens the doors to opportunity for all. —President Obama #CollegeOpportunity,693,978
2014-06-09 11:02,President Obama: At a time when higher education has never been more important it's also never been more expensive. #CollegeOpportunity,1096,1206
2014-06-09 11:05,I'm only here because this country gave me a chance through education. —President Obama #CollegeOpportunity,1174,1633
2014-06-09 11:08,As long as college costs keep soaring we can't just keep throwing money at the problem. —President Obama #CollegeOpportunity,699,1009
2014-06-09 11:11,More young people have been earning college degrees than ever before. That's something we should be proud of. —President Obama,982,1472
2014-06-09 11:15,We want young people to be in a position to pursue their dreams. —President Obama #CollegeOpportunity,1430,1650
2014-06-10 15:06,"It continues to be a very smart investment to go to college.” —President Obama #CollegeOpportunity,https://twitter.com/BarackObama/status/476485621733543936,838,1237,
2014/06/10_13:16,https://twitter.com/BarackObama,LIVE: President Obama answers questions about college affordability on @tumblr. Tune in: http://ofa.bo/hlR  #ObamaIRL,https://twitter.com/BarackObama/status/476457826336776192,380,541,
2014/06/10_11:34,https://twitter.com/BarackObama,Retweet if you agree: 51 years after the Equal Pay Act it's #TimeForProgress on equal pay.pic.twitter.com/A1jZXJwb5r,https://twitter.com/BarackObama/status/476432158668496896,5095,3239,https://pbs.twimg.com/media/BpyghgBCcAAXi02.png
2014/06/10_07:39,https://twitter.com/BarackObama,It's been 51 years since the Equal Pay Act was signed but women still don't have equal pay. #TimeForProgresspic.twitter.com/z8ojhj9Zr7,https://twitter.com/BarackObama/status/476372975252291585,4829,4632,https://pbs.twimg.com/media/BpxqsjECYAE7Yae.png
2014/06/09_16:28,https://twitter.com/BarackObama,Ask the President a question about college affordability for his Tumblr Q&A tomorrow: http://ofa.bo/snQ  #ObamaIRL #CollegeOpportunity,https://twitter.com/BarackObama/status/476143794581028866,437,615,
2014/06/09_15:13,https://twitter.com/BarackObama,Tonight the President talks about the need to #ActOnClimate on @YEARSofLIVING. Watch a short preview:http://ofa.bo/gmQ ,https://twitter.com/BarackObama/status/476124862029656066,462,608,
2014/06/09_14:02,https://twitter.com/BarackObama,Today President Obama took action to help millions of borrowers afford their student loan payments. #CollegeOpportunity,https://twitter.com/BarackObama/status/476107000019841024,1045,1442,
2014/06/09_11:20,https://twitter.com/BarackObama,This should be a no brainer."" —President Obama on reducing the burden of student loan debt #CollegeOpportunity",1194,1656
2014-06-10 15:19,See how President Obama is working to make college more affordable: http://ofa.bo/fn6  #CollegeOpportunity,559,871
2014-06-11 10:06,President Obama needs your help in reducing carbon pollution: http://ofa.bo/dlL  #ActOnClimate,567,707
2014-06-11 11:58,Watch: President Obama is making bold moves to act on climate change. http://ofa.bo/fnH  #ActOnClimate,401,550
2014-06-11 16:01,It’s frustrating for students who are working hard.—President Obama on the bill to reduce student debt blocked by some Senate Republicans,1460,1844
2014-06-11 17:52,Want a jumpstart on your organizing career? Become an @OFA Summer Fellow:http://ofa.bo/amA ,255,550
2014-06-11 18:46,Retweet if you agree with the President.pic.twitter.com/obmSqkLq1B,17874,8467
2014-06-12 08:24,A group of Senate Republicans refused to tackle the student loan debt crisis: http://ofa.bo/jmX  #DegreesNotDebt,510,587
2014-06-12 10:18,Add your name: Student loan debt is out of control. It's time to act. http://ofa.bo/ppr  #DegreesNotDebtpic.twitter.com/vRSBHkFYut,1457,1416
2014-06-12 11:19,Today President @GeorgeHWBush proved once again skydiving is for all ages. Happy birthday #41.pic.twitter.com/W5jUzkI1I3,1156,2215
2014-06-12 12:34,Add your name if you believe it's time to stand up for #DegreesNotDebt: http://ofa.bo/qnd ,634,943
2014-06-12 13:45,Take this survey: What's your top priority for @OFA? http://ofa.bo/qnl ,191,442
2014-06-12 14:59,Retweet if you think it's time to act on the student loan debt crisis. #DegreesNotDebtpic.twitter.com/tsV8qfRh2Q,7433,3578
2014-06-13 07:22,Michelle and I were saddened to hear of the passing of actress author and activist Ruby Dee. —President Obama,560,1142
2014-06-13 10:44,Add your name: The burden of student loan debt is too great. It's time to take action. http://ofa.bo/em9  #DegreesNotDebt,731,934
2014-06-13 11:49,Watch: This could be you this summer. http://ofa.bo/clt  #OFAFellows,243,529
2014-06-14 08:26,Watch President Obama's weekly address wishing dads a happy #FathersDay.http://ofa.bo/dmV ,478,841
2014-06-14 11:18,Don't miss the opportunity to be an @OFA Summer Fellow:http://ofa.bo/tpF ,277,609
2014-06-14 15:09,College graduates: Make sure you know your health care options. http://ofa.bo/cnE  #GetCoveredpic.twitter.com/TRXmoeViXu,753,1331
2014-06-15 07:09,Hugs for Dad: Happy Father's Day.pic.twitter.com/sfN0c39tHv,5016,10958
2014-06-16 08:36,Thanks to the Affordable Care Act getting covered means a health emergency won't break your bank.pic.twitter.com/xAoPLXIOPJ,768,1321
2014-06-16 09:52,The science is clear: Climate change is real. Help @OFA call out climate change deniers. http://ofa.bo/inw ,729,861
2014-06-16 11:32,This is huge: President Obama will prohibit federal contractors from discriminating based on sexual orientation or gender identity.,1571,2402
2014-06-16 13:00,Big news in the fight for #LGBT equality:http://ofa.bo/io1 ,877,1115
2014-06-16 14:06,Retweet if you think every American should be treated with dignity—regardless of their sexual orientation or gender identity.,11983,6431
2014-06-16 14:45,11 on the field more than 300 million cheering them on. #WorldCup #USMNTpic.twitter.com/vVjgAMXN0J,13102,11894
2014-06-17 07:38,One-question survey: Tell @OFA what issue you're most fired up to work on. http://ofa.bo/cq5 ,220,429
2014-06-17 10:42,LIVE: President Obama is in Pittsburgh speaking about spurring American manufacturing and innovation. http://ofa.bo/aqJ  #MadeInAmerica,225,450
2014-06-17 10:49,Companies instead of outsourcing are thinking about insourcing once again. —President Obama #MadeInAmerica,495,727
2014-06-17 10:54,We've seen entrepreneurship in manufacturing expand at the fastest pace that we've seen in 20 years. —President Obama #MadeInAmerica,347,562
2014-06-17 11:07,A lot of companies are realizing that family-friendly policies are good business—not just the right thing to do. —President Obama,629,904
2014-06-17 12:07,Add your name: It's time to end workplace discrimination against LGBT Americans. http://ofa.bo/cqd ,661,983
2014-06-17 13:40,Join the fight against LGBT discrimination: http://ofa.bo/brg ,2295,3466
2014-06-17 14:44,Save the date: The White House Summit on #WorkingFamilies is this Monday June 23. http://ofa.bo/bri pic.twitter.com/mEdDyYFphT,569,754
2014-06-18 07:39,This California olive grower is seeing the impacts of climate change firsthand: http://ofa.bo/eqc  #ActOnClimate,281,507
2014-06-18 09:02,LIVE: President Obama is speaking at the first-ever White House Maker Faire. Watch here: http://ofa.bo/aqj  #NationOfMakers,251,441
2014-06-18 09:11,One of the best ways to create more new jobs is to boost American manufacturing. —President Obama #NationOfMakers,531,789
2014-06-18 09:27,If you can imagine it then you can do it' ... That's a pretty good motto for America. —President Obama #NationOfMakers,1642,1752
2014-06-18 11:54,Great news: Financial assistance is cutting monthly premiums for some Americans by 76% thanks to health care reform.http://ofa.bo/fqm ,326,572
2014-06-18 15:30,"Fantastic news: ""Millions Get Obamacare Plans For $100 Or Less"" More from @HuffingtonPost:http://ofa.bo/jpF ",623,910
2014-06-19 07:42,It's unthinkable that—in 2014—someone could be fired because of who they are or whom they love: http://ofa.bo/gq2  #LGBT,1308,1581
2014-06-19 08:58,Don't forget to tune in on Monday to the White House Summit on #WorkingFamilies:http://ofa.bo/ptL ,242,496
2014-06-19 13:57,Kyle is a shining example of what our nation needs to encourage. —President Obama to Medal of Honor recipient Kyle Carpenter,388,785
2014-06-19 14:55,Watch what President Obama said today about the situation in Iraq:http://ofa.bo/iqO ,339,577
2014-06-19 15:59,It's time for paid leave policies that work for American families. #WorkingFamiliespic.twitter.com/y2HEfjSe9n,993,1653
2014-06-20 08:06,I commend the Massachusetts Legislature for ... taking action toward raising the state’s minimum wage. —President Obama,545,1085
2014-06-20 10:40,Another victory for equality: http://ofa.bo/iqX  #LoveIsLove,564,965
2014-06-20 12:13,Get ready for the White House Summit on #WorkingFamilies coming up on Monday: http://ofa.bo/arR pic.twitter.com/kIn4txeruN,458,678
2014-06-20 13:31,Nearly 60% of people who got insurance on the marketplace were uninsured—now they have affordable coverage: http://ofa.bo/frW ,442,866
2014-06-20 14:42,Most Americans support protecting LGBT Americans from workplace discrimination. Say you're one of them: http://ofa.bo/qrI ,1076,1651
2014-06-21 10:41,Solar energy is more accessible than you think: #ActOnClimate in your own community. #PutSolarOnItpic.twitter.com/XYJ38HoaQj,2313,1946
2014-06-21 12:23,Add your name: Climate change is happening now. Whose side are you on? http://ofa.bo/drR  #ActOnClimate,609,863
2014-06-21 14:48,Family leave. Childcare. Flexibility. These aren’t frills—they’re basic needs. Watch the weekly address:http://ofa.bo/drQ ,757,1209
2014-06-22 07:33,Don't forget: The White House Summit on #WorkingFamilies starts tomorrow at 9:00 a.m. ET. http://ofa.bo/stP ,345,661
2014-06-22 09:42,Watch: Now is the time to #ActOnClimate. http://ofa.bo/pv8 ,473,728
2014-06-22 12:13,Read the President's latest message to @OFA supporters: It's time to #RaiseTheWage.http://ofa.bo/rsm ,327,572
2014-06-23 06:34,Happening now: @VP and @DrBiden kick off the White House Summit on Working Families. http://ofa.bo/at6  #FamiliesSucceed,301,519
2014-06-23 08:21,Read President Obama's latest op-ed about the need for family-friendly workplace policies: http://ofa.bo/dsT  #FamiliesSucceed,413,576
2014-06-23 09:50,Retweet if you agree: Our economy succeeds when #FamiliesSucceed.pic.twitter.com/dXT9Bu6mW9,1976,1299
2014-06-23 10:31,President Obama will speak at the @WhiteHouse Summit on Working Families today at 1:40 p.m. ET: http://ofa.bo/ftF  #FamiliesSucceed,205,374
2014-06-23 10:50,WATCH: President Obama is speaking on how to create workplaces that support working families. http://ofa.bo/pve  #FamiliesSucceed,249,454
2014-06-23 11:02,Work gives us a place of dignity and income and is important. But families are the bedrock of our lives.—President Obama #FamiliesSucceed,886,950
2014-06-23 11:06,Many women can't even get a paid day off to give birth. You'd think that would be a pretty low bar. —President Obama #FamiliesSucceed,1241,1567
2014-06-23 11:09,In 31 states decent child care costs more than college tuition. —President Obama #FamiliesSucceed,600,864
2014-06-23 11:11,Nearly 28 million Americans would benefit if we raised the wage to $10.10 an hour. —President Obama #FamiliesSucceed #RaiseTheWage,860,1260
2014-06-23 11:14,Parents who work full time should earn enough to pay the bills. —President Obama #FamiliesSucceed,1158,1639
2014-06-23 11:16,Anything that makes life harder for women makes life harder for families. —President Obama #FamiliesSucceed,1506,1648
2014-06-23 11:19,A whole lot of fathers would love to be home for their babies' first weeks in the world. —President Obama #FamiliesSucceed,586,1061
2014-06-23 11:21,The bottom line is 21st century families deserve 21st century workplaces. —President Obama #FamiliesSucceed,499,873
2014-06-23 11:23,I promise you: You have a president who will take action to support working families. —President Obama #FamiliesSucceed,641,1115
2014-06-23 11:26,Even if Republicans in Congress refuse to budge on this issue this year everyone knows America deserves a raise. —President Obama,493,870
2014-06-23 11:27,Many of these issues are not partisan until they get to Washington. —President Obama,388,752
2014-06-23 11:31,I was raised by strong women who worked hard to support my sister and me. I saw what it was like for a single mom. —President Obama,1212,1953
2014-06-23 11:34,I take this personally because I'm the husband of a brilliant woman who struggled to balance work and raise our girls. —President Obama,967,1905
2014-06-23 11:36,No matter what you look like or where you come from here in America you can make it. — President Obama,2069,2499
2014-06-23 13:30,FACT: Women are now the primary or co-breadwinner in nearly two-thirds of American families. #FamiliesSucceed,1597,1776
2014-06-23 14:42,LIVE: @FLOTUS closes out the @WhiteHouse Summit on Working Families. Tune in: http://ofa.bo/dss  #FamiliesSucceed,203,460
2014-06-24 07:33,Help @OFA reach an amazing milestone: 500000 grassroots donors. http://ofa.bo/su9 ,203,429
2014-06-24 09:05,Full-time workers earning the national minimum wage make only $14500 a year. That's not enough: http://ofa.bo/ctk  #WithABetterWage,905,1055
2014-06-24 10:38,This matters.pic.twitter.com/j8XxNBBRSp,661,1264
2014-06-24 11:56,Be counted in this amazing grassroots milestone:http://ofa.bo/ctp ,176,436
2014-06-24 13:38,Sign this petition: It's time to raise the minimum wage. http://ofa.bo/ttV  #WithABetterWagepic.twitter.com/ZKLfgKoGVJ,825,1107
2014-06-24 15:04,See why these Americans believe in raising the minimum wage: http://ofa.bo/bv4  #WithABetterWagepic.twitter.com/gEBWXlv4z7,931,1084
2014-06-25 08:21,Help fight back against health care repealers. http://ofa.bo/auc pic.twitter.com/Ib0xpYnlgA,485,676
2014-06-25 09:23,Thanks to the Affordable Care Act you're covered at the pharmacy too.pic.twitter.com/Fywyh5IRBh,473,896
2014-06-25 10:40,One year ago President Obama introduced his Climate Action Plan. It's already making real progress: http://ofa.bo/svd  #ActOnClimate,398,703
2014-06-25 11:56,Here's one way to help @OFA call out climate change deniers in Congress: http://ofa.bo/cvC  #ActOnClimate,274,479
2014-06-25 14:16,Chip in today to help support the movement that's making progress where it counts: http://ofa.bo/rvS pic.twitter.com/HYXmHCKjXq,1070,1521
2014-06-26 07:35,Chip in today and put your name alongside those fighting for change: http://ofa.bo/axQ pic.twitter.com/wq8pT7ri7H,342,728
2014-06-26 09:08,Ready. #LetsDoThis #WorldCuppic.twitter.com/AgNq9veoqG,7312,8168
2014-06-26 10:17,Don't miss your chance to win a free trip to the Windy City: http://ofa.bo/szG ,213,560
2014-06-26 11:22,"This is what marriage means to those who have had the chance to say ""I do"": http://ofa.bo/tyE  #LoveIsLove",740,1098
2014-06-26 12:26,Happening now: President Obama hosts a town hall in Minneapolis. Tune in: http://ofa.bo/eyU  #OpportunityForAll,239,507
2014-06-26 13:57,You should own a piece of this: http://ofa.bo/jxu pic.twitter.com/9QqSBoLTd3,589,1036
2014-06-26 15:00,One year ago #DOMA was struck down. #LoveIsLovepic.twitter.com/0hLq1LSNKn,2934,3861
2014-06-26 16:10,You could win a free trip to Chicago this summer. Here's how: http://ofa.bo/gyq ,285,619
2014-06-27 07:49,One year ago today the Senate passed a bipartisan immigration reform bill. Leaders in the House have failed to act. #OneYearNoAction,688,815
2014-06-27 08:21,LIVE: President Obama is speaking about the economy from Minneapolis. Tune in: http://ofa.bo/izC  #OpportunityForAll,185,402
2014-06-27 08:27,We have come farther and recovered faster than just about any advanced economy on Earth. —President Obama #OpportunityForAll,353,681
2014-06-27 08:35,We are fighting so everybody has a chance. —President Obama #OpportunityForAll,592,862
2014-06-27 08:38,We do better when a young family knows that they can get ahead. —President Obama #OpportunityForAll,423,710
2014-06-27 08:41,We can't afford to wait for Congress right now. —President Obama,559,851
2014-06-27 08:44,President Obama: Gridlock and willful indifference can't get in the way of hard working American families. #OpportunityForAll,253,518
2014-06-27 08:47,More than 450000 of your neighbors are poised to get a raise. —President Obama on Minnesota raising the minimum wage #RaiseTheWage,333,681
2014-06-27 08:50,Our country is stronger when every American can count on affordable health insurance. —President Obama,540,1065
2014-06-27 08:54,I am always going to keep listening and I am always going to keep fighting.—President Obama #OpportunityForAll,964,1444
2014-06-27 09:57,Chip in and be automatically entered to join @OFA in Chicago to celebrate President Obama's birthday: http://ofa.bo/azu ,184,436
2014-06-27 11:21,Retweet if you agree with the majority of Americans who support comprehensive immigration reform. #OneYearNoAction,2242,1092
2014-06-27 12:36,You could celebrate in Chicago at @OFA's birthday party for President Obama: http://ofa.bo/a006 pic.twitter.com/MlfzNC8eDv,243,550
2014-06-27 14:37,Do your part to make change possible: http://ofa.bo/hzR pic.twitter.com/RdmYi4NPrx,1806,2195
2014-06-28 06:50,Watch the weekly address: President Obama will continue taking action and expanding #OpportunityForAll.http://ofa.bo/q01n ,299,566
2014-06-28 09:38,The Magnificent Mile Millennium Park deep dish pizza: You could win a free trip to Chicago this summer. http://ofa.bo/b02x ,245,589
2014-06-28 11:00,FACT: House leaders have stalled on immigration reform for a year and it's already cost the country more than $13 billion.,782,839
2014-06-28 12:21,Here's your chance to see the beautiful Chicago skyline for yourself this summer: http://ofa.bo/g01M pic.twitter.com/Gs4mMx4z4W,592,1472
2014-06-28 13:32,Hear how these couples describe what marriage has meant to them: http://ofa.bo/a01U  #LoveIsLove,422,797
2014-06-28 15:03,Skills. cc #USMNTpic.twitter.com/hzUHPsz3t9,2661,4336
2014-06-28 16:42,Support @OFA today and keep fighting for change: http://ofa.bo/c01q pic.twitter.com/7xw6aQIusx,1379,1929
2014-06-29 08:21,Looking for a summer vacation? Here's your chance to win a trip to Chicago on @OFA—enter today: http://ofa.bo/h00g ,240,526
2014-06-29 09:51,Climate change deniers and polluters must stop standing in the way of tackling this issue: http://ofa.bo/e021  #ActOnClimate,640,809
2014-06-29 11:02,Be part of this grassroots movement: http://ofa.bo/a01v pic.twitter.com/LF8Y8y8sBr,614,1136
2014-06-29 12:06,Health care reform has helped millions of Americans #GetCovered. Join the team keeping up the momentum:http://ofa.bo/j00v ,419,730
2014-06-29 13:16,This is how you can fight back against special interests' and polluters' anti-climate agenda: http://ofa.bo/h00s  #ActOnClimate,401,591
2014-06-29 14:42,Some members of Congress still won't accept the science of climate change. Help call them out: http://ofa.bo/p04m  #ActOnClimate,766,1035
2014-06-29 17:48,It's time to move forward on the issues that matter most with or without Congress:http://ofa.bo/r02U ,763,1249
2014-06-30 11:11,If you agree that women should be able to make their own health decisions fight for it: http://ofa.bo/d029  #StandWithWomen,1787,1967
2014-06-30 12:05,LIVE: President Obama is addressing the importance of taking action on #immigration reform. Tune in here:http://ofa.bo/s03n ,339,502
2014-06-30 12:10,One year ago this month senators from both parties … came together to pass a common-sense immigration bill. —President Obama,399,668
2014-06-30 12:12,That bill would strengthen our borders grow our economy shrink our deficits. —President Obama on the Senate-passed immigration bill,407,603
2014-06-30 12:14,For more than a year Republicans in the House have refused to hold a vote. —President Obama #ActOnReform,520,756
