Date,Text,Retweets,Likes
2013-09-24 13:22,Don't miss two Presidents discussing health care at #CGI2013. Watch the discussion at 4:55 p.m. ET: http://OFA.BO/r9xUUG ,289,178
2013-09-24 14:00,Happening now: President Obama and @BillClinton are discussing health care at #CGI2013. http://OFA.BO/RnYgW2 ,328,175
2013-09-24 14:15,A mom should not have to go bankrupt if her son or daughter gets sick ... I think most Americans agree with that —President Obama #CGI2013,1671,909
2013-09-24 14:20,Any young person who doesn't have health insurance can stay on their parents health insurance until they're 26 years old. —President Obama,931,570
2013-09-24 14:25,Health care costs have grown at the slowest rate in 50 years. We are bending the cost curve. —President Obama #CGI2013,449,215
2013-09-24 14:33,Go to http://healthcare.gov  take a look. —President Obama on shopping for health care options that are a good fit for you. #CGI2013,517,254
2013-09-24 14:38,I don't have pride of authorship on this I just want the thing to work. —President Obama on #Obamacare in each state #CGI2013,597,338
2013-09-24 14:44,Not only are premiums lower than they were they're lower than the most optimistic predictions. —President Obama on Obamacare #CGI2013,810,378
2013-09-25 07:47,Americans are standing up and saying #EnoughAlready to Congress. Join in: http://OFA.BO/3Js6am pic.twitter.com/72nxo9IL2n,926,578
2013-09-25 09:03,Americans don't want a government shutdown. http://OFA.BO/hqWJA5  #EnoughAlready,570,309
2013-09-25 09:49,95% of Americans live in states where average premiums in the new insurance marketplace will be lower than projected:http://OFA.BO/hYc2jb ,638,283
2013-09-25 11:50,Our work is not done. Help keep up the momentum on the issues that matter to you. Support @OFA: http://OFA.BO/D9io7C ,249,179
2013-09-25 12:57,Women deserve a #FairShot in all 50 states. Read @AmProg's report on how each state ranks: http://OFA.BO/iRDofr  #StandWithWomen,599,381
2013-09-25 15:30,Obamacare is the law of the land. Tell Congress #EnoughAlready: http://OFA.BO/fTzCgw pic.twitter.com/48GXxCatRF,1941,1009
2013-09-26 07:36,Watch President Obama speak about #Obamacare and #ABetterBargain for the middle class at 10:55 a.m. ET: http://OFA.BO/rf1kcx ,269,154
2013-09-26 07:58,LIVE: President Obama explains how the uninsured can #GetCovered with the new health care marketplace: http://OFA.BO/P3N4hK  #Obamacare,274,148
2013-09-26 08:01,In the wealthiest nation on earth no one should go broke just because they get sick. —President Obama #Obamacare,1973,904
2013-09-26 08:06,The Affordable Care Act is here. —President Obama,626,432
2013-09-26 08:11,Retweet if you agree: Women shouldn't have to pay more for their insurance just because they're women. #Obamacare,5757,1333
2013-09-26 08:17,"President Obama summarizing the new health care law for millions of Americans: ""You're covered.""",595,361
2013-09-26 08:23,We have seen the lowest growth in health care cost on record. —President Obama on the benefits of #Obamacare,342,222
2013-09-26 08:29,See for yourself what the prices are. See for yourself what the choices are. —President Obama on new options for the uninsured #GetCovered,418,211
2013-09-26 08:34,President Obama summarizes #Obamacare opponents' argument: Shut it down before people realize they like it.,739,403
2013-09-26 08:42,I will not negotiate on anything when it comes to the full faith and credit of the United States of America. —President Obama,844,508
2013-09-26 08:48,Let's make sure the United States of America keeps being a place where you can make it if you try. —President Obama,1338,796
2013-09-26 10:47,If you're sick and tired of Congress playing political games with Americans' health care tell them #EnoughAlready:http://OFA.BO/uAaFSL ,761,331
2013-09-26 12:04,Chip in $5 and help fight for the agenda Americans voted for in 2012: http://OFA.BO/iYkbkv ,186,130
2013-09-26 13:44,More good news on #Obamacare: Prices on the new health care exchange are looking good.http://OFA.BO/Mny2fQ ,476,262
2013-09-26 15:06,"Get your very own ""I Take Action"" magnet here: http://OFA.BO/dVfmMW ",257,216
2013-09-27 08:32,You can help keep up the momentum on issues like #immigration reform and #climate change. Support @OFA today: http://OFA.BO/1sSiVc ,388,225
2013-09-27 09:58,The @OFA donor wall shows that this is a grassroots movement belonging to millions: http://OFA.BO/tPXj2k pic.twitter.com/6E0MS4FBkA,351,306
2013-09-27 10:52,It's time Congress puts an end to governing from one manufactured crisis to the next. Tell them #EnoughAlready: http://OFA.BO/Sn4x8V ,658,312
2013-09-27 14:12,Put your name on the @OFA donor wall with a $5 contribution & show the world where you stand. http://OFA.BO/fvbAQc pic.twitter.com/SbygQcUpBC,298,359
2013-09-27 15:06,#FF @Madeleine. Welcome to Twitter Madam Secretary.,642,461
2013-09-28 08:23,Weekly address: Starting Tuesday millions of Americans finally have a chance to buy quality affordable health care.http://OFA.BO/TbdLX6 ,542,294
2013-09-28 08:36,Tuesday is also the day that a group of far-right Republicans in Congress might choose to shut down the government.http://OFA.BO/bnQ6Dh ,489,229
2013-09-28 10:05,Americans have worked too hard in this recovery to see extremists in Congress cause another crisis: http://OFA.BO/Go8pVk  #EnoughAlready,940,426
2013-09-28 11:50,Magnets are cool. http://OFA.BO/ddjjQc ,488,372
2013-09-28 12:42,A group of Republicans is willing to hurt our economy over a law they don't like. Tell them #EnoughAlready: http://OFA.BO/jmwnMQ ,950,378
2013-09-28 13:46,Past shutdowns have disrupted the economy and this one would be no different. Tell Congress to do its job: http://OFA.BO/7muoxo ,778,345
2013-09-28 16:36,They refuse to pass a budget unless I let them sabotage Obamacare. Read President Obama's message to supporters:http://OFA.BO/1xPgVD ,1234,514
2013-09-28 19:56,This is ridiculous. Instead of passing a real budget a group of House Republicans is playing politics with women's health. #EnoughAlready,3661,1695
2013-09-28 22:01,The House won't stop playing games with our economy. Tell them #EnoughAlready:http://OFA.BO/GvfX3K ,1101,460
2013-09-29 08:43,Congress needs to hear this: Do not shut down the government. Do not shut down the economy. http://OFA.BO/hndBrs  #EnoughAlready,1455,473
2013-09-29 10:20,There is still time for Congress to avoid a government shutdown. Tell them to do their jobs: http://OFA.BO/BAaYYi  #EnoughAlready,1094,401
2013-09-29 11:26,This is a key moment—chip in and support a movement that stands for progress: http://OFA.BO/dEytrX ,287,205
2013-09-29 13:29,A group of Republicans in the House won't stop playing games with our economy. Tell them #EnoughAlready: http://OFA.BO/MAwGVd ,842,368
2013-09-29 14:51,A $5 donation to @OFA will go a long way in supporting the agenda Americans voted for last November: http://OFA.BO/VmgW5z ,314,190
2013-09-30 08:00,Support @OFA and stand up to those trying to derail the agenda Americans voted for last November: http://OFA.BO/W23gtk ,287,173
2013-09-30 09:01,Say you won't stop fighting for women's rights. Chip in $5 and #StandWithWomen: http://OFA.BO/r6pdZ4 ,397,303
2013-09-30 10:46,It's your chance to support this movement—chip in $5 before tonight's deadline: http://OFA.BO/MsJJhz ,231,144
2013-09-30 11:55,Tonight's deadline is a critical moment. Support @OFA and make your voice heard: http://OFA.BO/vj752Q ,360,199
2013-09-30 13:05,This is the time to support the agenda Americans voted for last November—donate $5 before midnight: http://OFA.BO/FJ2mEY ,244,146
2013-09-30 14:10,The important part of the Affordable Care Act takes place tomorrow no matter what the House decides to do —President Obama on the shutdown,1173,451
2013-09-30 14:15,The Affordable Care act is moving forward. The funding is already in place. You can't shut it down. —President Obama,2150,853
2013-09-30 14:19,One faction of one party of one house of Congress ... doesn't get to shut down the entire government. —President Obama #EnoughAlready,2623,1037
2013-09-30 14:24,Congress needs to keep our government open—it needs to pay our bills on time. Time is running out. —President Obama #EnoughAlready,1657,598
2013-09-30 16:37,A government shutdown will have a real impact on real people right away—and the House is hours away from forcing one. #EnoughAlready,3894,999
2013-09-30 17:34,"From @thinkprogress: ""49 Republicans Who Say Shutting Down The Government Over Obamacare Is A Big Mistake"" http://OFA.BO/fHy5Qb ",1489,551
2013-09-30 18:58,A group of extremists in the House is hours away from shutting down the government. Tell them #EnoughAlready:http://OFA.BO/ebYXrw ,2572,748
2013-09-30 21:24,They actually did it. A group of Republicans in the House just forced a government shutdown over Obamacare instead of passing a real budget.,33271,10928
2013-09-30 21:27,Despite the shutdown the new health insurance marketplace opens for business as planned on October 1. #GetCovered,7273,2402
2013-09-30 21:31,The Affordable Care Act is moving forward. You can't shut it down. —President Obama #Obamacare,9115,3651
2013-10-01 06:54,This is huge: Today millions of Americans finally have the chance to enroll in quality affordable health care. #GetCovered,4439,2087
2013-10-01 09:38,Obamacare is here. #GetCovered,3744,2103
2013-10-01 10:02,LIVE: The President speaks about the new marketplace after meeting with Americans who will benefit from #Obamacare. http://OFA.BO/UFsH7G ,384,161
2013-10-01 10:07,I urge House Republicans to reopen the government. —President Obama,2321,873
2013-10-01 10:11,Many of the demands the Republicans are making would increase the deficit. —President Obama on the #shutdown,1082,428
2013-10-01 10:14,For the 15% of Americans who don't have health insurance this opportunity is life changing. —President Obama on the launch of #Obamacare,1567,710
2013-10-01 10:19,The Affordable Care Act is still open for business. —President Obama on @Obamacare,966,479
2013-10-01 10:28,Nobody gets to hurt our economy and hard-working families over a law you don't like. —President Obama #EnoughAlready,3793,1769
2013-10-01 10:32,We're better than this. —President Obama on the government shutdown #EnoughAlready,3106,1597
2013-10-01 12:55,Despite the efforts of extremists in the House of Representatives @Obamacare is not shut down:http://OFA.BO/64MGTg ,1390,814
2013-10-01 14:10,Shopping for affordable quality health care? Share your @Obamacare stories as you #GetCovered: http://OFA.BO/7Wpqid ,602,333
2013-10-02 09:16,Day two of @SpeakerBoehner's shutdown. Don’t put our economy or the American people through this any longer: #EnoughAlready,1905,845
2013-10-02 10:19,Take note: @Obamacare is here to stay.,4622,3149
2013-10-02 11:27,The decision to shut down the government is hurting local economies all across the country: http://OFA.BO/rVxsB3  #EnoughAlready,3862,2191
2013-10-02 13:04,Retweet if you want this #shutdown to end.,29724,6432
2013-10-02 14:50,Here's how the #shutdown is hurting every single state: http://OFA.BO/69ixTV  #EnoughAlready,1891,689
2013-10-03 08:00,Day three of the #BoehnerShutdown. Day three of the new @Obamacare marketplace providing health insurance options to millions.,1283,644
2013-10-03 08:16,House Republicans need to stop careening from one crisis to the other ... I'm tired of it. —President Obama on the #Shutdown,1437,742
2013-10-03 08:21,In a government shutdown millions of Americans—not just government workers ... face economic hardship. —President Obama #EnoughAlready,1519,629
2013-10-03 08:25,Heed the warnings of the Chamber of Commerce. They're all saying to Congress: 'Do your job.' —President Obama #EnoughAlready,812,383
2013-10-03 08:31,President Obama to Congress: Pass a budget. End the #GovernmentShutdown. Pay our bills. Prevent an economic shutdown. #JustVote.,2121,831
2013-10-03 10:20,Tea Party extremists caused this #BoehnerShutdown. Tell @SpeakerBoehner to end it now: http://OFA.BO/9cFiuk pic.twitter.com/WW4soKEibu,2402,973
2013-10-04 09:04,Day four of the #TeaPartyShutdown. @SpeakerBoehner stop letting extremists threaten our economy.,1518,727
2013-10-04 10:14,The #TeaPartyShutdown continues today and Americans are paying the price. Tell them to stop this: http://OFA.BO/Sg7u13 ,1002,383
2013-10-04 11:06,Let your representative know: The #TeaPartyShutdown is hurting our economy and must end now.http://OFA.BO/Xw9X3t ,971,418
2013-10-04 12:18,"The @USTreasury Secretary Jack Lew: ""U.S. failure to pay bills hurts everyone"" http://OFA.BO/6Deiff  #EnoughAlready",593,301
2013-10-04 13:28,Despite the #GovernmentShutdown the Affordable Care Act is here to stay. #FF: @Obamacare,1306,798
2013-10-04 14:18,. @SpeakerBoehner was against a government shutdown—until he created one. http://OFA.BO/PF7J6v  #TeaPartyShutdown,1112,526
2013-10-05 08:54,This week President Obama reads letters from Americans who've dealt with real-world consequences of the #shutdown:http://OFA.BO/vyrbcm ,557,327
2013-10-05 10:46,Watch: President Obama's message to @OFA about @Obamacare:http://OFA.BO/FETPQD ,282,212
2013-10-05 11:37,In this week's address President Obama calls on Congress to end this #shutdown immediately: http://OFA.BO/m7k6AC  #EnoughAlready,595,301
2013-10-05 12:03,Pass a budget. End this government shutdown. Pay our bills. Prevent an economic shutdown. —President Obama,1861,868
2013-10-05 12:42,The government shutdown is costly and irresponsible. It's time the #TeaPartyShutdown ended:http://OFA.BO/QAvsD2 ,1379,561
2013-10-05 14:18,The American people don’t get to demand ransom in exchange for doing their job. Neither does Congress. —President Obama on the #shutdown,2346,1070
2013-10-05 15:15,See why President Obama wants you to join Team @Obamacare: http://OFA.BO/bxC52K ,509,372
2013-10-06 08:56,Tell @SpeakerBoehner: End this #TeaPartyShutdown. http://OFA.BO/QqFc2k ,1172,522
2013-10-06 13:18,There are enough votes in the House to end the shutdown. @SpeakerBoehner: #JustVote.,3392,1347
2013-10-07 08:19,This #TeaPartyShutdown can end now— @SpeakerBoehner has the votes in the House. Tell him #JustVote:http://OFA.BO/2GDuDE ,1052,359
2013-10-07 09:20,Retweet if you want @SpeakerBoehner to #JustVote and end this shutdown.,8867,1185
2013-10-07 10:34,Watch @OFA's new ad and tell @SpeakerBoehner to stand up to the Tea Party Republicans. http://OFA.BO/fx1cDN  #EnoughAlready,439,204
2013-10-07 11:44,Despite what @SpeakerBoehner said he has the votes to end this shutdown. http://OFA.BO/ze4WB4  #JustVote,932,331
2013-10-07 13:29,Day seven of the #TeaPartyShutdown. Watch @OFA's new ad and tell @SpeakerBoehner to end this now: http://OFA.BO/nRTwSx ,555,224
2013-10-07 14:59,According to Republican Congressman @DentPressShop the votes are there to end the #shutdown. http://OFA.BO/sR5A6D  cc @SpeakerBoehner,1057,366
2013-10-07 18:45,Tell @SpeakerBoehner to count the votes in the House—there are enough to end the shutdown: http://OFA.BO/5wB7p4  #JustVote,1716,583
2013-10-08 08:14,Watch: The #TeaPartyShutdown is a manufactured crisis. Tell @SpeakerBoehner this must end:http://OFA.BO/8boukf ,574,280
2013-10-08 09:25,The #TeaPartyShutdown continues and Americans are paying the price. Tell @SpeakerBoehner to stop listening to extremists in his own caucus.,1116,405
2013-10-08 10:23,Count them: There are enough votes in the House to end this shutdown. @SpeakerBoehner: #JustVote. http://OFA.BO/FMM186 ,992,379
2013-10-08 11:14,LIVE: President Obama delivers a statement from the White House.http://OFA.BO/eMs5Ux ,366,197
2013-10-08 11:20,House Republicans don't get to demand ransoms in exchange for doing their jobs. —President Obama #JustVote,1646,760
2013-10-08 11:24,Let's lift these threats from our families and our businesses ... Let's get down to work. —President Obama #JustVote,644,315
2013-10-08 11:29,Warren Buffett likened default to a nuclear bomb—a weapon too terrible to use. —President Obama on the debt ceiling,626,298
2013-10-08 11:32,President Obama on the debt ceiling: It does not increase our debt grow our deficits or allow for a single dime in increased spending.,648,284
2013-10-08 11:36,The way we got to this point was one thing and one thing only: Republican obsession with dismantling Obamacare. —President Obama,1939,847
2013-10-08 11:41,It hurts our credibility around the world. It makes us look like we don't have our act together. —President Obama on the #shutdown,2234,986
2013-10-08 14:12,It's time @SpeakerBoehner ended this shutdown. Tell him to #JustVote: http://OFA.BO/NqxoJn ,1175,455
2013-10-08 15:04,That vote could take place today. The shutdown would be over. —President Obama http://OFA.BO/FTLirH  cc @SpeakerBoehner,993,476
2013-10-09 09:04,Stand with the President. Say #EnoughAlready: http://OFA.BO/3pAC4w pic.twitter.com/hlqfJqwfy4,2080,1018
2013-10-09 10:27,Watch the #TeaPartyShutdown in real time and see how it's harming our economy: http://OFA.BO/mNpFWT ,707,295
2013-10-09 12:44,Retweet if you think it's time to let the 800000 furloughed workers get back to work.pic.twitter.com/kKcaYhDaPd,8504,1360
2013-10-09 14:05,.@OFA_MA and @RaiseUpMA volunteers are working for a better minimum wage in Massachusetts. Join them:http://OFA.BO/decxvS ,369,237
2013-10-09 15:30,Americans are frustrated with the #TeaPartyShutdown and they're sending a clear message to @SpeakerBoehner: http://OFA.BO/EK5bAH ,1170,514
2013-10-10 08:43,The #TeaPartyShutdown couldn't stop #Obamacare but it has halted the nation's flu prevention program.pic.twitter.com/ehi81Do0vb,1447,492
2013-10-10 10:15,The #TeaPartyShutdown is making our food less safe. This must end now:http://OFA.BO/jkHXFk ,1084,472
2013-10-10 13:21,Americans are discovering how @Obamacare can help. Here are a few examples:http://OFA.BO/AfxuQd ,718,431
2013-10-11 07:25,Today is a day to celebrate being who you are. #NationalComingOutDaypic.twitter.com/jNIALpH20R,6637,3746
2013-10-11 08:33,This is important: The #TeaPartyShutdown is putting the safety of our food at risk.http://OFA.BO/YqKKoG ,876,288
2013-10-11 09:38,"From @WashingtonPost: ""Nine ways the shutdown will get more painful as it drags on"" http://OFA.BO/gm5Ybv  #EnoughAlready",568,276
2013-10-11 11:19,Watch: Americans want Tea Party Republicans to stop holding our economy hostage and end this shutdown. http://OFA.BO/oRXKbB  #EnoughAlready,954,429
2013-10-11 13:15,If the #shutdown continues paychecks for another 1M people who are currently working will be delayed: http://OFA.BO/fnFQn6  #EnoughAlready,1251,353
2013-10-11 14:49,The #TeaPartyShutdown stopped funding to Head Start programs keeping 7000 children out of school: http://OFA.BO/LoE1b  #EnoughAlready,1704,572
2013-10-12 09:11,Watch: President Obama says it's time to end the #shutdown and get back to the work of the American people.http://OFA.BO/FLM179 ,808,438
2013-10-12 11:38,Manufacturing crises to extract massive concessions isn’t how our democracy works and we have to stop it. —President Obama #EnoughAlready,1942,922
2013-10-13 10:19,During Domestic Violence Awareness Month the #TeaPartyShutdown has stopped aid to some 2000 shelters for victims:http://OFA.BO/XzAQ9c ,1800,420
2013-10-13 11:38,For 9 million women and children the #TeaPartyShutdown means nutritional assistance is in jeopardy.pic.twitter.com/zqr33u9YYz,1819,727
2013-10-14 07:34,Tell Tea Party Republicans to stop playing games with our economy. http://OFA.BO/iVKa99  #EnoughAlready,1515,712
2013-10-14 09:14,If the #shutdown continues to November 1 it will have cost the economy $5000000000. http://OFA.BO/z1X4fd  #EnoughAlready,3659,821
2013-10-14 11:03,The #TeaPartyShutdown is harming small businesses. Say you've had #EnoughAlready: http://OFA.BO/wozKPG pic.twitter.com/YlUt9AMno1,841,443
2013-10-14 13:24,This shutdown is affecting thousands of children every day. Say #EnoughAlready: http://OFA.BO/QG1GbX pic.twitter.com/QAsaKB0ZE1,510,309
2013-10-15 07:33,Michelle and I extend our best wishes for a joyous Eid al-Adha to Muslims around the world. —President Obama,3134,1586
2013-10-15 08:10,Add your voice—tell Tea Party Republicans to #EndThisNow: http://OFA.BO/Y2zzC4 ,625,226
2013-10-15 08:47,Tea Party Republicans are threatening an economic shutdown. Tell them to #EndThisNow: http://OFA.BO/uDi6r9 pic.twitter.com/g7JWG1OvLy,1552,525
2013-10-15 09:08,Retweet to tell Tea Party Republicans in the House of Representatives: Do your job. End the government shutdown now. #EndThisNow,5894,877
2013-10-15 09:59,If the debt ceiling isn't raised by Thursday America could face an economic shutdown. #EndThisNowpic.twitter.com/PCnKJD7l6v,1414,448
2013-10-15 10:39,This is serious. Add your voice and tell Congress to #EndThisNow: http://OFA.BO/bpTB6E ,743,253
2013-10-15 11:12,Be a part of @OFA's Twitter takeover and tell Congress to #EndThisNow: http://OFA.BO/e9wy4E ,545,222
2013-10-15 11:41,Retweet if you agree that shutting down the government is not a negotiating tactic. #EndThisNow,7551,1111
2013-10-15 12:36,America is just days away from an economic shutdown if Congress doesn't do its job. #EndThisNowpic.twitter.com/hocrO0GK9q,1939,873
2013-10-15 13:44,It's time to put people back to work. Tell Congress to #EndThisNow: http://OFA.BO/iSHMhm ,726,264
2013-10-15 14:23,An economic shutdown could cripple America's recovery. Tell Congress to #EndThisNow: http://OFA.BO/CZ4CsZ pic.twitter.com/dhekvrElFf,1088,434
2013-10-15 15:55,Thousands of furloughed workers have waited long enough for Congress to act on the shutdown. http://OFA.BO/qMFx7n  #EndThisNow,798,358
2013-10-15 16:35,Tea Party Republicans in Congress are threatening an economic shutdown. It's time to say: #EndThisNow http://OFA.BO/cvSQnS ,967,292
2013-10-15 17:07,Week 3 of the government shutdown and now Tea Party Republicans are threatening an economic shutdown. #EndThisNow: http://OFA.BO/y8FR9F ,939,273
2013-10-15 17:59,Retweet if you believe Congress shouldn't let one faction of one party drive our economy into a ditch. #EndThisNow,5462,926
2013-10-15 18:31,This is unacceptable. Tell Tea Party Republicans to stop holding our economy hostage: http://OFA.BO/qNmA3Y ,1535,566
2013-10-15 19:51,Retweet if you agree it's time to #EndThisNow before our country faces an economic shutdown.,7244,1115
2013-10-16 08:02,Day 16 of the #TeaPartyShutdown. This can't continue—Congress needs to #EndThisNow.,1201,488
2013-10-16 09:42,The American people can't afford an economic shutdown on top of a government shutdown. Tell Congress to #EndThisNow: http://OFA.BO/Dy5vX9 ,850,311
2013-10-16 10:16,An economic shutdown would be bad news for America's recovery. Tell Congress to #EndThisNow: http://OFA.BO/YM8AQm pic.twitter.com/3kQ1313NIL,879,400
2013-10-16 11:36,Retweet to tell @SpeakerBoehner to #EndThisNow.,3248,482
2013-10-16 19:48,Thanks to the millions of Americans who made their voices heard and helped bring the shutdown to an end. Now let's get back to work.,7097,4066
2013-10-16 20:10,Tonight the Republicans and Democrats in Congress have come together around an agreement that will reopen our government. —President Obama,6105,2756
2013-10-17 08:01,Watch the President speak about ending the #shutdown avoiding default and getting back to business:http://OFA.BO/zmrrFz ,375,257
2013-10-17 08:05,The first government shutdown in 17 years is now over. —President Obama,4201,1746
2013-10-17 08:09,Let's be clear there are no winners here ... The American people are completely fed up with Washington. —President Obama on the #shutdown,2654,1209
2013-10-17 08:13,The good news is we'll bounce back from this. We always do. America is the bedrock of the global economy for a reason. —President Obama,1036,558
2013-10-17 08:16,The issue is not growth versus fiscal responsibility. We need both. —President Obama on creating a budget that works,523,330
2013-10-17 08:19,We should finish the job of fixing our broken immigration system. —President Obama,968,582
2013-10-17 08:24,President Obama: Let's work together to make government work better—instead of treating it as an enemy or purposefully making it work worse.,1645,847
2013-10-17 08:28,"President Obama to furloughed workers: ""Thank you. Thanks for your service. Welcome back.""",877,582
2013-10-17 08:33,We come from different parties but we are Americans first ... Disagreement cannot mean disfunction. —President Obama,3287,1810
2013-10-17 13:25,President Obama's next priority: comprehensive #immigration reform. http://OFA.BO/NHNPcp ,1130,638
2013-10-18 11:21,It's time for lawmakers to get back to solving problems instead of creating them. #TimeForRealWork,1912,1076
2013-10-18 13:32,For weeks an extreme minority halted America's progress. Tell Congress—never let it happen again. http://OFA.BO/FKSz4J  #TimeForRealWork,770,417
2013-10-18 14:43,Tell Congress: Never let an extreme minority call the shots again. http://OFA.BO/X7hLwf  #TimeForRealWork,938,540
2013-10-19 09:45,It's #TimeForRealWork in Congress. It's time for a vote on #immigration reform in the House:http://OFA.BO/ktPiK5 ,732,438
2013-10-19 10:45,Watch this week's address where President Obama lays out bipartisan opportunities to help the American people:http://OFA.BO/dmox9J ,361,253
2013-10-19 11:58,The way business is done in Washington has to change. —President Obama on the #shutdown,933,635
2013-10-19 13:37,Sign this letter to Congress—tell them to never let an extreme minority derail our progress again: http://OFA.BO/fnTyUX  #TimeForRealWork,924,496
2013-10-20 08:53,Americans want Congress to solve real problems: http://OFA.BO/qGhAfN  #TimeForRealWork,624,365
