Date,Text,Retweets,Likes
2015-06-26 08:28,What a vindication of the belief that ordinary people can do extraordinary things. —President Obama #LoveWins,8894,13003
2015-06-26 08:29,Those countless often anonymous heroes—they deserve our thanks. —President Obama #LoveWins,8087,13127
2015-06-26 08:31,America should be very proud. —President Obama #LoveWins,23925,31417
2015-06-26 08:39,This ruling is a victory for friends families and organizers who fought tirelessly for years for marriage equality. #LoveWins,28494,34401
2015-06-26 08:44,Retweet to spread the word. #LoveWinspic.twitter.com/JJ5iCP4ZWn,184563,137498
2015-06-26 09:54,History. #LoveWinspic.twitter.com/5B3C2pBEXA,23673,30948
2015-06-26 10:16,Watch the President's full statement on the Supreme Court's ruling on marriage equality. #LoveWinshttp://www.snappytv.com/tc/664843 ,40324,57165
2015-06-26 11:49,LIVE: President Obama is speaking in Charleston honoring the life of Reverend Clementa Pinckney. http://ofa.bo/h8h7 ,1461,3552
2015-06-27 07:02,In the weekly address the President reaffirms how the Supreme Court ruling on #Obamacare is a victory for America:http://ofa.bo/g8Yp ,671,1979
2015-06-27 08:04,The Affordable Care Act still stands. It is working and it is here to stay. —President Obama http://ofa.bo/t8Z1  #ACAWorks,830,2550
2015-06-27 09:39,Two years ago today the Senate passed a bill to fix our broken immigration system with a bipartisan majority. #ImmigrationAction,782,2249
2015-06-27 09:45,The bill would have put millions of people on a path to citizenship and grown the economy by a cumulative $1.2 trillion. #ImmigrationAction,1229,2880
2015-06-27 09:50,Over the past two years the House’s failure to take #ImmigrationAction has cost the country $26.8 billion.,1462,2845
2015-06-27 09:55,The President is acting where he can but we need Congress to pass a comprehensive solution to fix our broken system. #ImmigrationAction,1363,3309
2015-06-27 11:19,You could be organizing in paradise: http://ofa.bo/h8iK pic.twitter.com/02a29XTEbT,550,1806
2015-06-28 13:23,Better hurry—the deadline to chip in is right around the corner: http://ofa.bo/q8Xl pic.twitter.com/261B8rX8ks,1053,4353
2015-06-28 15:04,Sign up for your chance to see firsthand how organizing is making a difference in Hawaii: http://ofa.bo/f8cc pic.twitter.com/MuoyB9HgMy,364,1075
2015-06-28 17:08,For too long we’ve been blind to the unique mayhem that gun violence inflicts upon this nation. —President Obama,2211,5046
2015-06-28 17:19,Add your name if you agree that it's time to stand up and do something about gun violence in America: http://ofa.bo/r8f7 ,2575,5331
2015-06-29 09:34,Organizing in paradise—the only thing missing is you: http://ofa.bo/h8jk pic.twitter.com/jI3VtkNiJR,348,1066
2015-06-29 11:32,Chip in—the deadline is quickly approaching: http://ofa.bo/t8b2 pic.twitter.com/o8FyZYYo5s,476,1671
2015-06-29 13:54,You've never seen greens like this. Enter now for your chance to win a trip to Hawaii: http://ofa.bo/g8bZ pic.twitter.com/yTD0j0UplR,546,1686
2015-06-29 15:35,Help break the silence on gun violence in America. Join the fight for common-sense reform: http://ofa.bo/p8iW ,1282,2484
2015-06-30 07:33,Don't miss your shot to chip in before tonight's deadline: http://ofa.bo/j8ag pic.twitter.com/8BhUWA0apv,585,1969
2015-06-30 08:40,Too many Americans are working long days for less pay than they deserve. —President Obama on overtime pay http://ofa.bo/i8gr ,1172,2356
2015-06-30 10:14,TONIGHT: Don't miss your chance to see Hawaii. Enter before the deadline. http://ofa.bo/g8dL pic.twitter.com/B2SF6XLc4g,344,1016
2015-06-30 13:12,BUZZER BEATER: There's not a lot of time left on the clock. Chip in $5 now. http://ofa.bo/q8aq pic.twitter.com/u4zDyut8li,784,1878
2015-06-30 15:22,Say you'll keep up the fight—show your support and chip in before midnight: http://ofa.bo/p8kS pic.twitter.com/YChVFtnzib,1729,5986
2015-06-30 16:25,LAST CALL: Enter for your chance to fly to Hawaii and relax in paradise. http://ofa.bo/h8mZ pic.twitter.com/cgmVDjMdfe,367,1060
2015-07-01 10:56,Tune in at 2:30 p.m. ET to watch the President discuss how we can build on the progress made under #Obamacare: http://ofa.bo/q8d3 ,249,697
2015-07-01 11:37,LIVE: The President is speaking about the benefits of #Obamacare and how to continue progress on health care reform. http://ofa.bo/i8iz ,263,764
2015-07-01 11:45,Everybody who has health insurance benefited and continues to benefit from this law. —President Obama,371,1054
2015-07-01 11:46,You're able to get free preventive care including mammograms as a consequence of this law. —President Obama,463,1265
2015-07-01 11:48,President Obama: #Obamacare has made health care stronger more secure and more reliable.,431,1212
2015-07-01 11:50,Not only has the law worked better than expected ... but it's ended up costing less than people expected. —President Obama #ACAWorks,357,1061
2015-07-01 11:51,I'm feeling pretty good about how health care is going. —President Obama #ACAWorks,444,1362
2015-07-01 11:53,The thing I've never lost sight of though is that this is about people. —President Obama,563,1469
2015-07-01 11:54,This wasn't about politics—this was about people. —President Obama,703,1770
2015-07-01 11:56,I'm hoping that what we can do now is focus on how we can make it better. —President Obama #ACAWorks,493,1327
2015-07-01 11:59,"“We want to educate people we want to listen to folks we want to hear good ideas from all sources."" —President Obama #ACAWorks",771,1755
2015-07-01 15:13,Three of the world's biggest economies announced new goals to #ActOnClimate:http://ofa.bo/i8j0 ,659,1357
2015-07-02 08:16,The economy added 223000 jobs in June—marking 64 consecutive months of private-sector job growth.,954,2299
2015-07-02 10:20,In the past two years the U.S. economy has created 5.6 million jobs—the strongest two-year job growth since 2000:http://ofa.bo/s8he ,838,1713
2015-07-02 11:13,Tune in at 2:30 p.m. ET to watch President Obama talk about the progress made on the economy: http://ofa.bo/h8nk ,268,636
2015-07-02 11:36,LIVE: President Obama is at @UWLaCrosse speaking about economic progress. http://ofa.bo/q8dM ,227,581
2015-07-02 11:41,No matter where you live this is a special time of year to be an American. —President Obama,605,1644
2015-07-02 11:43,It's been a remarkable few weeks in America. —President Obama,744,1862
2015-07-02 11:44,The freedom to marry who you love—that's now open to all of us. That's a good thing. —President Obama #LoveWins,1399,2634
2015-07-02 11:46,America has always done better economically when we're all in it together. When everyone gets a fair shot. —President Obama,417,1116
2015-07-02 11:47,This morning we learned that our businesses created another 223000 jobs last month. —President Obama,426,1069
2015-07-02 11:48,All told we've now seen 64 straight months of private-sector job growth which is a new record. —President Obama,550,1136
2015-07-02 11:50,12.8 million new jobs and that's good—but we've got more work to do. —President Obama,510,1237
2015-07-02 11:51,We've got to make folks feel like their hard work is getting them somewhere. —President Obama #FixOvertime,555,1266
2015-07-02 11:53,And by the way our teachers are underpaid. —President Obama,3183,4645
2015-07-02 11:54,We've added nearly 900000 new manufacturing jobs. —President Obama,423,1136
2015-07-02 11:55,Today our high school graduation rate is at an all-time high. —President Obama,722,1865
2015-07-02 11:57,We put in place the toughest Wall Street reform in history that's protecting main street from another crisis. —President Obama,310,829
2015-07-02 11:58,The uninsured rate in America is now the lowest on record. —President Obama #ACAWorks,457,1199
2015-07-02 11:59,Not only are more people getting health care businesses are able to start giving raises to their workers. —President Obama,362,1017
2015-07-02 12:00,Middle-class economics works. —President Obama,323,997
2015-07-02 12:02,We've been talking about the middle class since before it was cool. —President Obama,620,1561
2015-07-02 12:04,The bottom line is: Top-down economics doesn't work. Middle-class economics works. —President Obama,749,1575
2015-07-02 12:06,We need to boost the minimum wage. Give America a raise. —President Obama #RaiseTheWage,847,1795
2015-07-02 12:07,Folks forget sometimes—unions are what helped bring about the 40-hour work week. —President Obama,826,1636
2015-07-02 12:08,We're stronger together than we are by ourselves. —President Obama,1081,1926
2015-07-02 12:10,Over the past couple of years 17 states almost 30 counties and cities have taken action to raise the minimum wage. —President Obama,421,1271
2015-07-02 12:11,This is an issue of basic fairness: If you work longer and you work harder you should get paid for it. —President Obama #FixOvertime,837,1864
2015-07-02 12:13,In America a hard day's work deserves a fair day's pay. —President Obama,981,2260
2015-07-02 12:14,No middle-class family should be priced out of the education that they need. —President Obama,1225,2699
2015-07-02 12:15,When the playing field is level American workers always win. —President Obama,438,1378
2015-07-02 12:17,The last seven years—shoot the last seven days—should remind us there's nothing America cannot do. —President Obama,1261,3153
2015-07-02 12:19,If we're walking down that road together we're going to get there faster. —President Obama,1122,2381
2015-07-02 12:21,Happy Fourth of July everybody. God bless you. God bless America. —President Obama,2711,5609
2015-07-02 13:33,Updating overtime pay rules will benefit nearly five million American workers: http://ofa.bo/q8dw  #FixOvertime,722,1722
2015-07-04 08:31,Happy Fourth of July.pic.twitter.com/NrN0dpCNIr,6164,15561
2015-07-04 09:46,From my family to yours have a safe and happy Fourth of July. —President Obamahttp://ofa.bo/p8s0 ,1965,6075
2015-07-05 15:01,Good luck to the U.S. Women’s National Team in the World Cup Final! —President Obama #SheBelievespic.twitter.com/UlONxdmVjl,7564,13558
2015-07-06 08:02,Because a hard day's work deserves a fair day's pay.pic.twitter.com/IOLCpSls0e,1082,2438
2015-07-06 11:53,ICYMI: Read why President Obama's plan to update overtime rules is a big deal for middle-class workers.http://ofa.bo/f8oo ,441,942
2015-07-06 13:02,Expanding overtime protections will benefit nearly five million Americans. Show your support—add your name today: http://ofa.bo/h8ul ,505,1208
2015-07-07 08:05,Add your name if you think it's time to #FixOvertime protections for hard-working Americans: http://ofa.bo/t8n8 ,582,1395
2015-07-07 10:30,Read how the Obama administration plans to help renters and low-income homeowners gain easier access to solar energy:http://ofa.bo/s8pw ,587,1230
2015-07-07 12:37,Expanding overtime protections will improve the lives of middle-class families. Read more: http://ofa.bo/h8wP  #FixOvertime,556,1323
2015-07-08 08:17,Add your name—because a hard day's work deserves a fair day's pay: http://ofa.bo/f8sQ  #FixOvertime,522,1317
2015-07-08 10:21,You inspired a whole new generation of young women. —President Obama to the @ussoccer_wnt #SheBelieveshttps://amp.twimg.com/v/fc2e88af-6d97-407f-b85e-df30920d7bdb …,2747,5386
2015-07-08 12:27,Add your name if you think it’s time to expand overtime protections for hard-working Americans: http://ofa.bo/g8qg  #FixOvertime,598,1528
2015-07-09 08:10,Thanks to #Obamacare women are saving more than a billion dollars in out-of-pocket contraceptive costs.http://ofa.bo/r8vy ,746,2095
2015-07-09 12:10,Read @VP Biden's thoughts on how marriage equality makes our country a better place: http://ofa.bo/i8vI  #LoveIsLove,504,1195
2015-07-09 15:02,Everyone deserves the same benefits no matter who they love. http://ofa.bo/p90a  #LoveIsLove,1402,3349
2015-07-10 08:33,Be part of the movement working for lasting progressive change: http://ofa.bo/q8qj  #OFActionpic.twitter.com/41TwFryRem,421,898
2015-07-10 10:42,The uninsured rate is now at the lowest level to date—thanks to #Obamacare: http://ofa.bo/s8vp ,727,1730
2015-07-10 14:15,The President just took steps to protect more than one million acres of public land: http://ofa.bo/q8rR pic.twitter.com/NJeEKCHW9a,1439,3794
2015-07-11 10:56,In the weekly address the President discusses how to make it easier for communities to adopt the Fair Housing Act:http://ofa.bo/j8vq ,441,1118
2015-07-11 15:32,Too often where people live determines what opportunities they have in life. —President Obamahttp://ofa.bo/j8vq ,2088,3670
2015-07-13 07:42,Tune in at 11:15 a.m. ET to watch the President deliver remarks at the @WhiteHouse Conference on Aging: http://ofa.bo/j8yJ  #WHCOA,412,859
2015-07-13 08:21,LIVE: President Obama is speaking at the 2015 White House Conference on Aging. http://ofa.bo/q8xF  #WHCOA,337,784
2015-07-13 10:31,Read the President's op-ed in @AARP on the importance of protecting Americans’ retirement savings:http://ofa.bo/p98W ,336,802
2015-07-13 13:55,WATCH: Get the facts on why it's time to #FixOvertime protections for millions of workers. http://ofa.bo/j8zE ,426,940
2015-07-14 11:06,Congratulations to @NASANewHorizons on completing a three-billion-mile journey. #PlutoFlybypic.twitter.com/cRaz9aSe7K,4923,8495
2015-07-14 12:22,Tune in at 4:05 p.m. ET to watch President Obama deliver remarks at the @NAACP's National Convention: http://ofa.bo/p99c  #NAACP106,341,682
2015-07-14 13:55,LIVE: The President is speaking about criminal justice reform at the @NAACP National Convention. http://ofa.bo/s93y  #NAACP106,415,720
2015-07-14 13:58,Let's get something out of the way up front: I am not singing today. —President Obama,625,1687
2015-07-14 14:01,I would not be here and so many others would not be here without the NAACP. —President Obama,474,1075
2015-07-14 14:03,We made progress but our work is not done. —President Obama #NAACP106,484,1062
2015-07-14 14:05,Health care is not a privilege for the few but a right for all of us. —President Obama,1365,2226
2015-07-14 14:11,We can't be satisfied—are not satisfied—until the opportunity gap is closed for everybody in America. —President Obama #NAACP106,679,1169
2015-07-14 14:12,There is a long history of inequity in the criminal justice system in America. —President Obama,1049,1339
2015-07-14 14:13,In too many cases our criminal justice system becomes a pipeline from underfunded schools to overcrowded jails. —President Obama,1765,1983
2015-07-14 14:17,The United States is home to 5 percent of the world's population but 25 percent of the world's prisoners. —President Obama,2134,1921
2015-07-14 14:18,In 1980 there were 500000 people behind bars in America ... Today there are 2.2 million. —President Obama,1401,1375
2015-07-14 14:20,Our prison population has doubled in the last two decades alone. —President Obama,804,1172
2015-07-14 14:21,If we're going to deal with this problem and the inequities involved we're going to have to speak honestly. —President Obama,746,1255
2015-07-14 14:22,Over the last few decades we've locked up more and more nonviolent drug offenders for longer than ever before. —President Obama,1417,1591
2015-07-14 14:23,In far too many cases the punishment does not fit the crime. —President Obama,1599,1979
2015-07-14 14:24,For $80 billion we could double the salary of every high school teacher in America. —President Obama,2590,3099
2015-07-14 14:24,Every year we spend $80 billion to keep those folks incarcerated. —President Obama,1809,1611
2015-07-14 14:26,Roughly one-third of the Justice Department's budget now goes toward incarceration. —President Obama,976,1103
2015-07-14 14:27,African Americans and Latinos make up 30 percent of our population. They make up 60 percent of our inmates. —President Obama,3087,2565
2015-07-14 14:28,A growing body of research shows that people of color are more likely to be frisked stopped questioned detained. —President Obama,1949,2038
2015-07-14 14:29,African Americans are more likely to be arrested. They are more likely to be sentenced to more time for the same crime. —President Obama,2667,2414
2015-07-14 14:32,Around one million fathers are behind bars. Around one in nine African-American kids has a parent in prison. —President Obama,1650,1676
2015-07-14 14:34,Our nation is being robbed of men and women who could be workers and taxpayers. —President Obama,1019,1566
2015-07-14 14:35,Our criminal justice system isn't as smart as it should be. —President Obama,1392,1825
2015-07-14 14:36,Mass incarceration makes our country worse off—and we need to do something about it. —President Obama,1212,1787
2015-07-14 14:37,This is a cause that is bringing people in both houses of Congress together. —President Obama,350,796
2015-07-14 14:39,For the first time in 40 years America's crime rate and incarceration rate went down at the same time. —President Obama,909,1635
2015-07-14 14:40,I believe crime is like any other epidemic—we need to stop it before it starts. —President Obama,948,1678
2015-07-14 14:41,If we make investments early in our children we will reduce the need to incarcerate those kids. —President Obama,1834,2277
2015-07-14 14:42,One study found that for every dollar we invest in Pre-K we save at least twice that in reduced crime. —President Obama,1610,2323
2015-07-14 14:43,We recognize that every child deserves opportunity. Not just some. Not just our own. —President Obama,1434,2163
2015-07-14 14:44,What doesn't make sense is treating entire neighborhoods as danger zones. —President Obama,1205,1866
2015-07-14 14:45,We gotta make sure boys and girls in those communities are loved and cherished and nurtured and invested in. —President Obama,980,1800
2015-07-14 14:46,We have to restore trust between our police and some of the communities where they serve. —President Obama,866,1619
2015-07-14 14:48,Don't just tag them as future criminals. Reach out to them as future citizens. —President Obama,1335,2341
2015-07-14 14:51,For nonviolent drug crimes we need to lower long mandatory minimum sentences—or get rid of them entirely. —President Obama,2755,3839
2015-07-14 14:52,We should pass a sentencing reform bill through congress this year. —President Obama,802,1541
2015-07-14 14:54,On Thursday I will be the first sitting president to visit a federal prison. —President Obama,1937,3281
2015-07-14 14:55,We should not tolerate conditions in prison that have no place in any civilized country. —President Obama,950,1915
2015-07-14 14:56,I've asked my Attorney General to start a review of the overuse of solitary confinement in our federal prisons. —President Obama,1101,2027
2015-07-14 14:57,Let's reward prisoners with reduced sentences if they complete programs that make them less likely to repeat an offense. —President Obama,1139,2313
2015-07-14 14:59,Justice is not only the absence of oppression—it is the presence of opportunity. —President Obama,1757,2155
2015-07-14 15:01,Justice is making sure that every young person knows that they are special and their lives matter. —President Obama,1586,2359
2015-07-14 15:02,Justice is living up to the common creed that I am my brother's keeper and I am my sister's keeper. —President Obama,906,1782
2015-07-14 15:03,Justice and redemption go hand in hand. —President Obama,934,1816
2015-07-14 15:04,We are not perfect but we have the capacity to be more perfect—mile after mile step after step. —President Obama,1787,2685
2015-07-14 15:05,We cannot ignore the problems that we have but we can't stop running the race. —President Obama,1098,2133
2015-07-14 15:06,If we keep taking steps toward a more perfect union ... America will move forward. There's nothing we can't do. —President Obama,1019,2341
2015-07-15 08:45,Read the emotional exchange between the President and a former addict:http://ofa.bo/s945 ,645,1395
2015-07-15 10:26,LIVE: President Obama is speaking about the #IranDeal. http://ofa.bo/j90S ,435,897
2015-07-15 13:04,Taking #ImmigrationAction is the right thing to do.pic.twitter.com/Qmkkv3dqfr,625,1403
2015-07-15 15:19,Tune in at 6:45 p.m. ET to watch President Obama speak about ensuring internet access for all Americans: http://ofa.bo/f95O ,477,1065
2015-07-15 16:07,LIVE: The President is speaking about expanding high-speed broadband to low-income households. http://ofa.bo/t91p ,692,1557
2015-07-16 10:47,Read how President Obama is laying the groundwork for criminal justice reform:http://ofa.bo/h9Bz ,858,1771
2015-07-17 08:19,Read why these three congressmen believe #Obamacare is working:http://ofa.bo/t927 ,444,1086
2015-07-17 10:44,From my family to yours Eid Mubarak! —President Obama,4840,7139
2015-07-17 12:17,Yesterday President Obama became the first sitting president to visit a federal prison. Read some of the highlights:http://ofa.bo/r96E ,1221,2342
2015-07-17 13:43,Read how @OFA volunteers are pushing to #RaiseTheWage in their communities: http://ofa.bo/j90p pic.twitter.com/l3sk0J6875,542,1391
2015-07-18 06:39,In the weekly address President Obama explains the comprehensive #IranDeal: http://ofa.bo/c4sd ,510,1160
2015-07-18 08:04,This deal will make America and the world safer and more secure. —President Obama on the #IranDealhttp://ofa.bo/c4sd ,824,2105
2015-07-20 09:17,Stand with the President's plan to make sure more people have access to a secure and dignified retirement: http://ofa.bo/e4r2 ,529,1378
2015-07-20 12:09,We are not just Americans but citizens of Earth. — @StationCDRKelly http://ofa.bo/f96E pic.twitter.com/nGPsTVC4Hh,1805,3674
2015-07-20 13:18,Tune in at 5:00 p.m. ET to watch the President speak on the 25th anniversary of the Americans with Disabilities Act: http://ofa.bo/f96F ,395,820
2015-07-20 14:34,LIVE: The President is speaking about the 25th anniversary of the Americans with Disabilities Act. http://ofa.bo/t92X ,414,995
2015-07-20 14:42,Days like today are a celebration of our history. But they're also a chance to rededicate ourselves to the future. —President Obama #ADA25,642,1391
2015-07-20 14:45,A few years ago I issued an executive order requiring the federal government to hire more Americans with disabilities. —President Obama,599,1698
2015-07-20 14:47,This is not just about American rights. It's about human rights. —President Obama #ADA25,1067,2424
2015-07-20 15:01,We still have more to do to make sure that people with disabilities are paid fairly for their labor. —President Obama #ADA25,1129,2373
2015-07-21 08:17,Opponents of common-sense immigration reform are standing in the way of progress: http://ofa.bo/f96n ,517,1119
2015-07-21 10:32,Nearly 10000 Americans turn 65 every day. Stand up for a society that's ready for a changing America: http://ofa.bo/h9DB ,594,1488
2015-07-22 09:43,"Check out the President's final appearance on @TheDailyShow—and his newest ""executive order"": http://ofa.bo/a4yQ pic.twitter.com/ku6QZx2nE1",842,2207
2015-07-22 13:57,The President's #ImmigrationAction will be good for the economy—but opponents are standing in the way: http://ofa.bo/f978 ,587,1235
2015-07-23 09:17,Carbon pollution from power plants is being reduced even as the economy grows. Read more: http://ofa.bo/q91a  #ActOnClimate,609,1422
2015-07-23 10:47,Great news: Jobless claims just fell to the lowest level in four decades. http://ofa.bo/e4s3 ,1153,2290
2015-07-23 12:52,States across the country are taking action to #RaiseTheWage for hard-working residents: http://ofa.bo/b507 ,598,1399
2015-07-23 14:51,Investing in energy efficiency and renewable energy will help cut consumer electricity bills. Read more:http://ofa.bo/h9Dc ,864,1885
2015-07-24 10:23,Have questions about the historic #IranDeal? Follow @TheIranDeal for information and updates. #FF,389,999
2015-07-24 12:06,Some states are making real progress to #RaiseTheWage. Read more:http://ofa.bo/p9Bf ,569,1315
2015-07-24 14:13,See what your state's minimum wage is with this state-by-state tracker: http://ofa.bo/h9Dr  #RaiseTheWage,609,1301
2015-07-25 13:04,In the weekly address President Obama discusses the progress we've made because of Wall Street reform: http://ofa.bo/p9Bn ,379,1068
2015-07-25 14:00,We should reward drive innovation and fair play. That’s what Wall Street reform does. —President Obamahttp://ofa.bo/p9Bn ,835,1925
2015-07-27 09:01,American businesses are pledging $140 billion to reduce carbon pollution and #ActOnClimate:http://ofa.bo/q920 ,873,1843
2015-07-27 11:20,It's the final week of #NationalIceCreamMonth—better take advantage.pic.twitter.com/WQk1T37XhU,1595,4197
2015-07-27 14:33,Join the team that's spreading the truth on the most important issues: http://ofa.bo/g95L ,442,1190
2015-07-28 09:14,Read how @OFA is training the next generation of digital organizers: http://ofa.bo/f983  #OFAFellowspic.twitter.com/BBKr9KzZnK,330,788
2015-07-28 12:52,Study shows #Obamacare leads to fewer uninsured Americans better health and improved access to care:http://ofa.bo/e4ss ,809,1756
2015-07-28 14:35,ICYMI: Some of America's largest businesses are investing in clean energy to cut carbon pollution. http://ofa.bo/g95a  #ActOnClimate,828,1855
2015-07-29 09:40,You don't have to be a policy expert to make a difference on issues like climate change:http://ofa.bo/t94d ,851,1995
2015-07-30 10:33,Solar energy is booming. #ActOnClimatepic.twitter.com/sQ8YnZhOT0,1343,2603
2015-07-30 14:17,Help President Obama cap off a great year. Wish him a happy birthday: http://ofa.bo/f99r  #44Turns54pic.twitter.com/fCnSmJTUw1,2455,6758
2015-07-31 08:46,Sign @OFA's birthday card for President Obama: http://ofa.bo/q93h  #44Turns54pic.twitter.com/58CrYK8VU5,830,2363
